<?xml version="1.0" encoding="UTF-8"?>
<entityConf xsi:noNamespaceSchemaLocation="../../entityconf.xsd"
	xmlns:xsi="http://www.w3.org/2001/XMLSchema-instance" backend="com.ant.crawler.core.ListSiteCrawler">

	<entityFields>
		<rssSite>
		</rssSite>
		<listSite>
			<itemXpath>//ul[@class='list_m']/li</itemXpath>
			<field xpath="a/@href" name="tempSource">
				<filter type="scriptone">
					<![CDATA[
						var URL = Java.type("java.net.URL");
						var url = new URL(entity.getSourceUrl(), field);
						entity.setDetailUrl(url);
					]]>
				</filter>
			</field>
			<field xpath="a[span[@class='trailer'] or span[@class='cam']]" name="filterQuality" required="false">
				<filter type="scriptone">
					<![CDATA[
						entity.setDetailUrl(null);
					]]>
				</filter>
			</field>
			<field xpath="a/span[@class='title']/text()" name="title"></field>
			<field xpath="a/span[@class='poster']/img/@data-original" name="thumbnail">
				<filter type="scriptone">
					<![CDATA[
						var URL = Java.type("java.net.URL");
						var url = new URL(entity.getSourceUrl(), field);
						field= url.toString();
						var Date = Java.type("java.util.Date");
						entity.set("create_date", new Date());
						entity.set("owner_email", "tronglongcntt@gmail.com");
						entity.set("parrent", 0);
						entity.set("view", java.util.concurrent.ThreadLocalRandom.current().nextInt(20, 50));
					]]>
				</filter>
			</field>
		</listSite>
		<detailSite>
			<field xpath="//div[@class='dt']/p[contains(., 'Thể loại: ')]/span/a/text()" name="tags"  required="false">
				<filter type="regexone" replace=", "> - </filter>
				<filter type="regexall" replace=", ">\n</filter>
			</field>

<!-- 			<field xpath="//div[@class='movie-info']/div[@class='breadcrumbs fjx-top']/style" name="btnWatch">
				<filter type="scriptone">
					<![CDATA[
						var xemphim = "http://xemphimso.com/xem-phim/online";
						var index = field.indexOf(xemphim);
						if (index == -1) {
							field = null;
							return;
						}
						var end = field.indexOf("\"", index);
						field = field.substring(index, end);
						
						var anchor = node.getHtmlPageOrNull().getFirstByXPath("//div[@class='movie-info']/div[@class='breadcrumbs fjx-top']/div[@class='item']/a");
						anchor.setAttribute("href", field);
					]]>
				</filter>
			</field> -->
			<expand link="//div[@class='dt']/p[last()]/span/a[1]">
				<field xpath="//div[@id='area_t']/script[@type='text/javascript' and not(@src)][1]/text()" name="embed_web">
					<filter type="scriptone">
						<![CDATA[
							try {
								var prefix = "{file: \"";
								var index = 0; 
								var setup = field;
								field = null;
								while ((index = setup.indexOf(prefix, index)) >= 0) {
									index += prefix.length();
									var end = setup.indexOf("\"", index);
									if (end == -1) {
										return;
									}
									var movie = setup.substring(index, end);
									java.lang.System.out.println(movie);
									if (movie.endsWith("=m22")) {
										field = "direct*" + movie;
									}
								}
							} catch (e) {
								//e.printStackTrace();
								field = null;
							}
						]]>
					</filter>
				</field>
			</expand>
		</detailSite>
	</entityFields>
	<categories mappingField="category_id">
		<category id="1">
			http://mphim.net/phim-le.html
		</category>
	</categories>
</entityConf>