<?xml version="1.0" encoding="UTF-8"?>
<entityConf xsi:noNamespaceSchemaLocation="../../entityconf.xsd"
	xmlns:xsi="http://www.w3.org/2001/XMLSchema-instance" backend="com.ant.crawler.core.ScriptSubEntityCrawler">

	<entityFields>
		<rssSite>
		</rssSite>
		<listSite>
			<itemXpath>//div[@id='content']/div[starts-with(@class, 'post')]</itemXpath>
			<field xpath="div/a/div[@class='post-info-wrap clearfix']/span[@class='mvif vid-hd']/text()" name="filter_quality">
				<filter type="scriptone"><![CDATA[ if (!field.equals("HD")) field = null;]]></filter>
			</field>
			<field xpath="div/a/@href" name="tempSource">
				<filter type="scriptone">
					<![CDATA[
						var URL = Java.type("java.net.URL");
						var url = new URL(entity.getSourceUrl(), field);
						entity.setDetailUrl(url);
					]]>
				</filter>
			</field>
			<field xpath="div/a/img/@src" name="thumbnail">
				<filter type="scriptone">
					<![CDATA[
						var URL = Java.type("java.net.URL");
						var url = new URL(entity.getSourceUrl(), field);
						field= url.toString();
						var Date = Java.type("java.util.Date");
						entity.set("create_date", new Date());
						entity.set("owner_email", "tronglongcntt@gmail.com");
						entity.set("parrent", 1);
						entity.set("view", 10);
					]]>
				</filter>
			</field>
		</listSite>
		<detailSite>
			<field xpath="//div[@class='movie-info']/h1/text() | //div[@class='movie-info']/p[@class='grtx']/text()" name="title">
				<filter type="regexall" replace=" - ">\n</filter>
			</field>
			<field xpath="//div[@class='movie-content clearfix']/*" name="description" required="false"></field>
			<field xpath="//div[@class='movie-info']/p[text()='Thể loại: ']/span/a/text()" name="tags"  required="false">
				<filter type="regexone" replace="Hàn Quốc">Hàn Quốc HD</filter>
				<filter type="regexone" replace="Hài Hước">Phim Hài</filter>
				<filter type="regexone" replace="Hoạt Hình">Phim Hoạt Hình HD</filter>
				<filter type="regexall" replace=", ">\n</filter>
			</field>
		</detailSite>
		<subEntity link="//div[@class='movie-info']/div[@class='movie-button clear']/a">
			<scriptSite xpath="//div[@id='severlist']/script[@type='text/javascript']/text()">
						<![CDATA[
							var index = field.indexOf("LINK: ");
							if (index == -1) {
								field = null;
								return;
							}
							field = field.substring(index + 6, field.length() - 1);
							
							var movies = JSON.parse(field);
							var decoder = java.util.Base64.getUrlDecoder();
							var index;
							for (index = 0; index < movies.length; ++index) {
								var movie = movies[index];
								var IOUtils = Java.type("org.apache.commons.io.IOUtils");
								var URL = Java.type("java.net.URL");
								try {
									var state = IOUtils.toString(new URL("http://sharephim.vn/get_picasa/0/" + movie.link));
									if (state.length() > 10) {
										java.lang.System.out.println(state);
										field = new java.lang.String(decoder.decode(movie.link));
										var subEntity = entity.newSubEntity();
										subEntity.setSubID(movie.name);
										if (movie.name.length() == 1) {
											movie.name = "0" + movie.name;
										}
										subEntity.set("title", movie.name);
										subEntity.set("embed_web", field);
										subEntity.set("view", 0);
									}
								} catch (e) {
								}
							}
						]]>
			</scriptSite>
			<detailSite></detailSite>
		</subEntity>
	</entityFields>
	<categories mappingField="category_id">
		<category id="1">
		http://phim16.com/xem/tag/phim-bo-hoan-thanh/page/12/
		http://phim16.com/xem/tag/phim-bo-hoan-thanh/page/11/
		http://phim16.com/xem/tag/phim-bo-hoan-thanh/page/10/
		http://phim16.com/xem/tag/phim-bo-hoan-thanh/page/9/
		http://phim16.com/xem/tag/phim-bo-hoan-thanh/page/8/
		http://phim16.com/xem/tag/phim-bo-hoan-thanh/page/7/
		http://phim16.com/xem/tag/phim-bo-hoan-thanh/page/6/
		http://phim16.com/xem/tag/phim-bo-hoan-thanh/page/5/
		http://phim16.com/xem/tag/phim-bo-hoan-thanh/page/4/
		http://phim16.com/xem/tag/phim-bo-hoan-thanh/page/3/
			http://phim16.com/xem/tag/phim-bo-hoan-thanh/page/2/
			http://phim16.com/xem/tag/phim-bo-hoan-thanh/
		</category>
	</categories>
</entityConf>