<?xml version="1.0" encoding="UTF-8"?>
<entityConf xsi:noNamespaceSchemaLocation="../../conf/entityconf.xsd"
	xmlns:xsi="http://www.w3.org/2001/XMLSchema-instance" backend="com.ant.crawler.core.ListSiteCrawler">

	<entityFields>
		<rssSite>
		</rssSite>
		<listSite>
			<itemXpath>//div[@id='content']/div[starts-with(@class, 'post')]</itemXpath>
			<field xpath="div/a/@href" name="tempSource">
				<filter type="scriptone">
					<![CDATA[
						var URL = Java.type("java.net.URL");
						var url = new URL(entity.getSourceUrl(), field);
						entity.setDetailUrl(url);
					]]>
				</filter>
			</field>
			<field xpath="div/a/img/@src" name="thumbnail">
				<filter type="scriptone">
					<![CDATA[
						var URL = Java.type("java.net.URL");
						var url = new URL(entity.getSourceUrl(), field);
						field= url.toString();
						var Date = Java.type("java.util.Date");
						entity.set("create_date", new Date());
						entity.set("owner_email", "tronglongcntt@gmail.com");
						entity.set("parrent", 0);
						entity.set("view", 10);
					]]>
				</filter>
			</field>
		</listSite>
		<detailSite>
			<field xpath="//div[@class='movie-info']/h1/text()" name="title"></field>
			<field xpath="//div[@class='movie-content clearfix']/*" name="description" required="false"></field>
			<field xpath="//div[@class='movie-info']/p[text()='Thể loại: ']/span/a/text()" name="tags"  required="false">
				<filter type="regexall" replace=", ">\n</filter>
			</field>
			<expand link="//div[@class='movie-info']/div[@class='movie-button clear']/a/@href">
				<field
				xpath="//div[@id='severlist']/script[@type='text/javascript']/text()" name="embed_web">
					<filter type="scriptone">
						<![CDATA[
							var index = field.indexOf("LINK: ");
							if (index == -1) {
								field = null;
								return;
							}
							field = field.substring(index + 6, field.length() - 1);
							java.lang.System.out.println(field);
							var movies = JSON.parse(field);
							var decoder = java.util.Base64.getUrlDecoder();
							var movie = movies[movies.length - 1];
							if (movie.name == "Xem Full" || movies.length == 1) {
								field = new java.lang.String(decoder.decode(movie.link));
							} else {
								field = null;
							}
						]]>
					</filter>
				</field>
			</expand>
		</detailSite>
	</entityFields>
	<categories mappingField="category_id">
		<category id="1">
			http://phim16.com/phim/phim-hanh-dong-moi/
		</category>
	</categories>
</entityConf>