<?xml version="1.0" encoding="UTF-8"?>
<entityConf xsi:noNamespaceSchemaLocation="../../entityconf.xsd"
	xmlns:xsi="http://www.w3.org/2001/XMLSchema-instance" backend="com.ant.crawler.core.ListSiteCrawler">

	<entityFields>
		<rssSite>
		</rssSite>
		<listSite>
			<itemXpath>//div[@class="box_film"]</itemXpath>
			<field xpath="div[1]/a/@href" name="tempSource">
				<filter type="scriptone">
					<![CDATA[
						var URL = Java.type("java.net.URL");
						var url = new URL(entity.getSourceUrl(), field);
						entity.setDetailUrl(url);
					]]>
				</filter>
			</field>
			<field xpath="div[1]/a/img/@src" name="thumbnail">
				<filter type="scriptone">
					<![CDATA[
						var URL = Java.type("java.net.URL");
						var url = new URL(entity.getSourceUrl(), field);
						field= url.toString();
						var Date = Java.type("java.util.Date");
						entity.set("create_date", new Date());
						entity.set("owner_email", "tronglongcntt@gmail.com");
						entity.set("parrent", 0);
						entity.set("view", java.util.concurrent.ThreadLocalRandom.current().nextInt(10, 30));
					]]>
				</filter>
			</field>
		</listSite>
		<detailSite>
			<field xpath="//div[@class='movie_info_right']/table/tbody/tr[contains(., 'Thể Loại')]/td[2]/h2/text()" name="filter_movie">
				<filter type="scriptone">
					<![CDATA[
						if (!field.equals("Phim Lẻ")) {
							field = null;
						}
					]]>
				</filter>
			</field>
			<field xpath="//h1[@class='tenphim']/text()" name="title">
			</field>
			<field xpath="//div[@class='movie_info_right']/table/tbody/tr[contains(., 'Năm Phát Hành')]/td[2]/text()" name="tempTitle">
				<filter type="scriptone">
					<![CDATA[
						field = field.trim();
						var title = entity.get("title");
						if (!title.contains(field)) {
							entity.set("title", title + " " + field);
						}
					]]>
				</filter>
			</field>
			<field xpath="//div[@class='movie_info_right']/table/tbody/tr[contains(., 'Nhóm Phim')]/td[2]/text()" name="tags"  required="false">
				<filter type="regexone" replace=", "> - </filter>
				<filter type="regexall" replace=", ">\n</filter>
			</field>
			
			<field xpath="//html/head/title/text()" name="embed_web">
				<filter type="scriptone">
					<![CDATA[
					try {
						field = null;
						//find id
						var url = entity.getSourceUrl().toString();
						var index = url.lastIndexOf('_');
						if (index == -1) {
							return;
						}
						var id = url.substring(index + 1, url.length() - 5);
						
						//find server id
						var IOUtils = Java.type("org.apache.commons.io.IOUtils");
						var URL = Java.type("java.net.URL");
						var server = IOUtils.toString(new URL("http://movie.onb.vn/getserver.ashx?id=" + id));
						server = server.toLowerCase();
						java.lang.System.out.println(server);
						var indexFull = server.indexOf("full");
						if (indexFull == -1) {
							return;
						}
						var serverIdStart = server.lastIndexOf("id=\"", indexFull);
						if (serverIdStart == -1) {
							return;
						}
						serverIdStart += 4;
						var serverIdEnd = server.indexOf('"', serverIdStart);
						if (serverIdEnd == -1) {
							return;
						}
						var serverId = server.substring(serverIdStart, serverIdEnd);
						field = "http://www.phimrap24h.com/getlink.ashx?id=" + serverId;
						java.lang.System.out.println(field);
					} catch (e) {
						field = null;
					}
					]]>
				</filter>
			</field>
		</detailSite>
	</entityFields>
	<categories mappingField="category_id">
		<category id="1">
		<![CDATA[
		http://www.phimrap24h.com/home/movie.aspx
			]]>
		</category>
	</categories>
</entityConf>