<?xml version="1.0" encoding="UTF-8"?>
<entityConf xsi:noNamespaceSchemaLocation="../../entityconf.xsd"
	xmlns:xsi="http://www.w3.org/2001/XMLSchema-instance" backend="com.ant.crawler.core.ListSiteCrawler">

	<entityFields>
		<rssSite>
		</rssSite>
		<listSite>
			<itemXpath>//ul[@id='cat_tatca']/li</itemXpath>
			<field xpath="div/div[1]/div[1]/ul/li/span/strong/text()" name="filterQuality">
				<filter type="scriptone">
					<![CDATA[
						if (!field.equals("HD")) {
							field = null;
						}
					]]>
				</filter>
			</field>
			<field xpath="div/a/@href" name="tempSource">
				<filter type="scriptone">
					<![CDATA[
						var URL = Java.type("java.net.URL");
						var url = new URL(entity.getSourceUrl(), field);
						entity.setDetailUrl(url);
					]]>
				</filter>
			</field>
			<field xpath="div/div[1]/p[@class]/text()" name="title">
				<filter type="regexone" replace=" - ">\n </filter>
			</field>
			<field xpath="div/a/span[1]/img/@src" name="thumbnail">
				<filter type="scriptone">
					<![CDATA[
						var URL = Java.type("java.net.URL");
						var url = new URL(entity.getSourceUrl(), field);
						field= url.toString();
						var Date = Java.type("java.util.Date");
						entity.set("create_date", new Date());
						entity.set("owner_email", "tronglongcntt@gmail.com");
						entity.set("parrent", 0);
						entity.set("view", java.util.concurrent.ThreadLocalRandom.current().nextInt(40, 60));
					]]>
				</filter>
			</field>
		</listSite>
		<detailSite>
			<field xpath="//div[@class='media-body']/div[@class='tn-contentmt']" name="description" required="false"></field>
			<field xpath="//ul[@class='filminfo-fields']/li[contains(text(), 'Thể loại')]/a/text()" name="tags"  required="false">
				<filter type="regexone" replace="Tình Cảm">Tâm Lý Tình Cảm</filter>
				<filter type="regexall" replace=", ">\n</filter>
			</field>
			<field xpath="//iframe/@src[contains(., 'drive.google.com')]" name="embed_web">
				<filter type="scriptone">
					<![CDATA[
					try {
						var encoder = java.util.Base64.getUrlEncoder();
						var IOUtils = Java.type("org.apache.commons.io.IOUtils");
						var URL = Java.type("java.net.URL");
						var state = IOUtils.toString(new URL("http://phimdb.net/get_picasa/0/" + encoder.encodeToString(field.getBytes()).replace('_', '/')));
						java.lang.System.out.println(state);
						if (state.length() < 10) {
							field = null;
						}
						field = "<iframe src='" + field + "' width='868' height='480' frameborder='0' allowfullscreen></iframe>";
					} catch (e) {
						//e.printStackTrace();
						field = null;
					}
					]]>
				</filter>
			</field>
		</detailSite>
	</entityFields>
	<categories mappingField="category_id">
		<category id="1">
			http://xuongphim.tv/danh-sach/phim-le.html
		</category>
	</categories>
</entityConf>