<?xml version="1.0" encoding="UTF-8"?>
<entityConf xsi:noNamespaceSchemaLocation="../../entityconf.xsd"
	xmlns:xsi="http://www.w3.org/2001/XMLSchema-instance" backend="com.ant.crawler.core.ListSiteCrawler">

	<entityFields>
		<rssSite>
		</rssSite>
		<listSite>
			<itemXpath>//*[@id='list-view-2']/div[@id='haivl-list-content']/article</itemXpath>
			<field xpath="header/div[@class='detail-info']/h2/a/@href" name="tempSource">
				<filter type="scriptone">
					<![CDATA[
						var URL = Java.type("java.net.URL");
						var url = new URL(entity.getSourceUrl(), field);
						entity.setDetailUrl(url);
						
						var Date = Java.type("java.util.Date");
						entity.set("create_date", new Date());
						entity.set("owner_id", "95");
						entity.set("type", 0);
						var ThreadLocalRandom = Java.type("java.util.concurrent.ThreadLocalRandom");
						entity.set("view", ThreadLocalRandom.current().nextInt(300, 400));
						entity.set("like_count", 0);
					]]>
				</filter>
			</field>
			<field xpath="header/div[@class='detail-info']/h2/a/text()" name="title">
				<filter type="scriptone">
					<![CDATA[ field = field.trim();
							field = field.replace("haiivl", "khuckhich");
					 ]]>
				</filter>
			</field>
		</listSite>
		<detailSite>
			<field xpath="//div[@class='content-detail']/a/img/@src" name="content">
				<filter type="scriptone">
					<![CDATA[
						field = field.trim();
						if (field.startsWith("//")) {
							field = "http:" + field;
						}
					]]>
				</filter>
			</field>
		</detailSite>
	</entityFields>
	<categories mappingField="category_id">
		<category id="1">
			http://haivn.com/
		</category>
	</categories>
</entityConf>